{
  "$schema": "../../schemas/wire-conformance-case-results.schema.json",
  "protocol_version": "nnrp-1-preview4",
  "suite_version": "0.1.0",
  "target_name": "sample-preview4-target",
  "results": [
    {
      "id": "wire.control.cancel-abort.client",
      "outcome": "passed",
      "terminal": "cancelled",
      "observed_frames": [
        {
          "direction": "sent",
          "frame": "CANCEL",
          "payload": {
            "operation_id": "op-cancel-1"
          },
          "timestamp_us": 1200
        },
        {
          "direction": "received",
          "frame": "TRACE_CONTEXT",
          "payload": {
            "frame_id": 0,
            "trace_id": "trace-cancel-1",
            "span_id": "span-drop-reason"
          },
          "timestamp_us": 1300
        },
        {
          "direction": "received",
          "frame": "RESULT_DROP_REASON",
          "payload": {
            "reason": "superseded"
          },
          "timestamp_us": 1400
        }
      ],
      "evidence_paths": [
        "artifacts/wire-evidence/cancel-abort.jsonl"
      ]
    },
    {
      "id": "wire.host-route.client.multi-route",
      "outcome": "passed",
      "terminal": "success",
      "route_evidence": {
        "application_endpoint": "nnrp://host-route.test",
        "candidates": [
          {
            "transport": "tcp",
            "provider_id": "nnrp.transport.tcp.native",
            "requested_locator": "suite://allocate/tcp/client-primary",
            "locator_resolved": true,
            "security_satisfied": true,
            "selected": true
          },
          {
            "transport": "ipc",
            "provider_id": "nnrp.transport.ipc.native",
            "requested_locator": "suite://allocate/ipc/client-secondary",
            "locator_resolved": true,
            "security_satisfied": true,
            "selected": false
          }
        ],
        "listeners": [],
        "accepted_sessions": [
          {
            "transport": "tcp",
            "provider_id": "nnrp.transport.tcp.native",
            "active_transport": "tcp"
          }
        ],
        "atomic_rollback": false,
        "logical_set_closed": false
      },
      "evidence_paths": ["artifacts/wire-evidence/client-multi-route.jsonl"]
    }
  ]
}
